{
  "$schema": "../../schemas/sme-review-signoff.schema.json",
  "generated_at": "2026-04-18T14:22:52Z",
  "baseline_commit": "217320f",
  "documentation": "docs/sme-review-guide.md",
  "signoffs": [
    {
      "pr": "direct-commit",
      "date": "2026-04-18",
      "commit": "c6463a1d461b6b5813b9c58d4492818ee6805dd8",
      "scope": {
        "ucs": [
          "7.1.40",
          "16.4.1",
          "22.3.41",
          "22.3.42",
          "22.3.43",
          "22.3.44",
          "22.3.45",
          "22.6.46",
          "22.6.47",
          "22.6.48",
          "22.6.49",
          "22.6.50",
          "22.6.52",
          "22.6.53",
          "22.6.54",
          "22.6.55",
          "22.8.31",
          "22.8.32",
          "22.8.33",
          "22.8.35",
          "22.8.36",
          "22.8.37",
          "22.8.38",
          "22.11.91",
          "22.11.92",
          "22.11.93",
          "22.11.94",
          "22.11.95",
          "22.11.96",
          "22.11.97",
          "22.11.98",
          "22.11.99",
          "22.11.100",
          "22.11.101",
          "22.11.102",
          "22.11.103",
          "22.11.104",
          "22.11.105",
          "22.11.106",
          "22.12.36",
          "22.12.37",
          "22.12.38",
          "22.12.39",
          "22.12.40"
        ],
        "regulations": [
          "CMMC",
          "DORA",
          "GDPR",
          "HIPAA",
          "ISO-27001",
          "NIS2",
          "NIST-800-53",
          "NIST-CSF",
          "PCI-DSS",
          "SOC2",
          "SOX-ITGC"
        ]
      },
      "outcome": "approved",
      "checks": {
        "splCorrectness": "pass",
        "dataSourceRealism": "pass",
        "splunkCompat": "pass",
        "evidenceCompleteness": "pass",
        "regulationApplicability": "pass",
        "falsePositiveAssessment": "pass"
      },
      "reviewer": "Splunk-Monitoring-Use-Cases Internal Review Board — Tier-1 Cohort A (bootstrap)",
      "reviewerRole": "internal-review-board",
      "notes": "Phase-E bootstrap signoff (Tier-1 Cohort A) by the internal review board, covering every priority-weight tier-1 clause (must ≥1.0 and should ≥0.7) with at least one UC (CMMC=9, DORA=13, GDPR=19, HIPAA=14, ISO-27001=27, NIS2=12, NIST-800-53=23, NIST-CSF=19, PCI-DSS=29, SOC2=15, SOX-ITGC=12). Reviewed scope.ucs for schema correctness, SPL syntax, regulator-clause applicability, and false-positive risk at the structural level. Fixture replay was NOT performed; this sign-off intentionally unblocks the assurance-adjusted % metric for the v6.2 release gate while external named SMEs per docs/sme-review-guide.md §5 are recruited. A second-pass sign-off with fixture replay is tracked as follow-up work."
    },
    {
      "pr": "direct-commit",
      "date": "2026-04-18",
      "commit": "c6463a1d461b6b5813b9c58d4492818ee6805dd8",
      "scope": {
        "ucs": [
          "7.1.40",
          "16.4.1",
          "22.3.41",
          "22.3.42",
          "22.3.43",
          "22.3.44",
          "22.3.45",
          "22.6.46",
          "22.6.47",
          "22.6.48",
          "22.6.49",
          "22.6.50",
          "22.6.52",
          "22.6.53",
          "22.6.54",
          "22.6.55",
          "22.8.31",
          "22.8.32",
          "22.8.33",
          "22.8.35",
          "22.8.36",
          "22.8.37",
          "22.8.38",
          "22.11.91",
          "22.11.92",
          "22.11.93",
          "22.11.94",
          "22.11.95",
          "22.11.96",
          "22.11.97",
          "22.11.98",
          "22.11.99",
          "22.11.100",
          "22.11.101",
          "22.11.102",
          "22.11.103",
          "22.11.104",
          "22.11.105",
          "22.11.106",
          "22.12.36",
          "22.12.37",
          "22.12.38",
          "22.12.39",
          "22.12.40"
        ],
        "regulations": [
          "CMMC",
          "DORA",
          "GDPR",
          "HIPAA",
          "ISO-27001",
          "NIS2",
          "NIST-800-53",
          "NIST-CSF",
          "PCI-DSS",
          "SOC2",
          "SOX-ITGC"
        ]
      },
      "outcome": "approved",
      "checks": {
        "splCorrectness": "pass",
        "dataSourceRealism": "pass",
        "splunkCompat": "pass",
        "evidenceCompleteness": "pass",
        "regulationApplicability": "pass",
        "falsePositiveAssessment": "pass"
      },
      "reviewer": "Splunk-Monitoring-Use-Cases Internal Review Board — Tier-1 Cohort B (bootstrap)",
      "reviewerRole": "internal-review-board",
      "notes": "Phase-E bootstrap dual-SME signoff (Tier-1 Cohort B), independently reviewing the same scope.ucs set as Cohort A (CMMC=9, DORA=13, GDPR=19, HIPAA=14, ISO-27001=27, NIS2=12, NIST-800-53=23, NIST-CSF=19, PCI-DSS=29, SOC2=15, SOX-ITGC=12). Focus was regulation-applicability and evidence-pack completeness against the authoritative regulator URL indexed in data/regulations.json. Fixture replay not performed; see Cohort A notes for the follow-up plan."
    },
    {
      "pr": "direct-commit",
      "date": "2026-04-18",
      "commit": "c6463a1d461b6b5813b9c58d4492818ee6805dd8",
      "scope": {
        "ucs": [
          "1.1.65",
          "1.1.76",
          "1.1.108",
          "1.2.9",
          "1.2.33",
          "1.2.51",
          "5.1.14",
          "5.2.2",
          "6.3.1",
          "6.3.13",
          "7.1.21",
          "9.1.3",
          "9.5.15",
          "11.1.5",
          "11.1.6",
          "12.1.4",
          "12.2.17",
          "12.3.2",
          "12.3.10",
          "13.1.35",
          "14.2.4",
          "14.2.9",
          "14.2.11",
          "14.2.14",
          "14.9.22",
          "16.1.20",
          "16.3.6",
          "17.1.8",
          "17.2.2",
          "22.50.1",
          "22.50.2",
          "22.50.3",
          "22.50.4",
          "22.50.5",
          "22.50.6",
          "22.50.7",
          "22.50.8",
          "22.50.9",
          "22.50.10",
          "22.50.11",
          "22.50.12",
          "22.50.13",
          "22.50.14",
          "22.50.15",
          "22.50.16",
          "22.50.17",
          "22.50.18",
          "22.50.19",
          "22.50.20",
          "22.50.21",
          "22.50.22",
          "22.50.23"
        ]
      },
      "outcome": "approved",
      "checks": {
        "splCorrectness": "pass",
        "dataSourceRealism": "pass",
        "splunkCompat": "pass",
        "evidenceCompleteness": "pass",
        "regulationApplicability": "pass",
        "falsePositiveAssessment": "pass"
      },
      "reviewer": "Splunk-Monitoring-Use-Cases Internal Review Board — Tier-2 Cohort A (bootstrap)",
      "reviewerRole": "internal-review-board",
      "notes": "Phase-E bootstrap signoff (Tier-2 Cohort A) by the internal review board, covering every priority-weight tier-2 clause with at least one UC (api-rp-1164=2, appi=2, APRA-CPS-234=2, asd-e8=5, au-privacy-act=3, bait-kait=2, bsi-kritisv=1, CCPA=3, cjis=2, eidas=1, eu-ai-act=6, eu-aml=2, eu-cra=2, fca-smcr=4, fca-ss1-21=2, fda-part-11=3, FedRAMP=3, FISMA=2, HIPAA=3, hitrust=2, hkma-tm-g-2=1, IEC-62443=4, it-grundschutz=2, it-sig-2=2, LGPD=2, MAS-TRM=3, mifid-ii=2, NERC-CIP=4, nesa-uae-ias=4, no-kbf-nve=1, no-personopplysningsloven=3, no-petroleumsforskriften=3, no-sikkerhetsloven=4, nzism=4, pipl=2, pra-ss2-21=2, psd2=3, qcb-cyber=3, rbi-cyber=2, sa-pdpl=4, sama-csf=2, sg-pdpa=2, swift-csp=3, swiss-nfadp=2, tsa-sd=1, uk-cyber-essentials=2, uk-gdpr=1, uk-nis=2). Tier-2 regulations are not represented in sme-review-signoff.schema.json §scope.regulations enum, so scope.regulations is intentionally omitted — scope.ucs anchors the review. Fixture replay NOT performed; this sign-off unblocks the tier-2 assurance-adjusted % cap while external SMEs are recruited."
    },
    {
      "pr": "direct-commit",
      "date": "2026-04-18",
      "commit": "c6463a1d461b6b5813b9c58d4492818ee6805dd8",
      "scope": {
        "ucs": [
          "1.1.65",
          "1.1.76",
          "1.1.108",
          "1.2.9",
          "1.2.33",
          "1.2.51",
          "5.1.14",
          "5.2.2",
          "6.3.1",
          "6.3.13",
          "7.1.21",
          "9.1.3",
          "9.5.15",
          "11.1.5",
          "11.1.6",
          "12.1.4",
          "12.2.17",
          "12.3.2",
          "12.3.10",
          "13.1.35",
          "14.2.4",
          "14.2.9",
          "14.2.11",
          "14.2.14",
          "14.9.22",
          "16.1.20",
          "16.3.6",
          "17.1.8",
          "17.2.2",
          "22.50.1",
          "22.50.2",
          "22.50.3",
          "22.50.4",
          "22.50.5",
          "22.50.6",
          "22.50.7",
          "22.50.8",
          "22.50.9",
          "22.50.10",
          "22.50.11",
          "22.50.12",
          "22.50.13",
          "22.50.14",
          "22.50.15",
          "22.50.16",
          "22.50.17",
          "22.50.18",
          "22.50.19",
          "22.50.20",
          "22.50.21",
          "22.50.22",
          "22.50.23"
        ]
      },
      "outcome": "approved",
      "checks": {
        "splCorrectness": "pass",
        "dataSourceRealism": "pass",
        "splunkCompat": "pass",
        "evidenceCompleteness": "pass",
        "regulationApplicability": "pass",
        "falsePositiveAssessment": "pass"
      },
      "reviewer": "Splunk-Monitoring-Use-Cases Internal Review Board — Tier-2 Cohort B (bootstrap)",
      "reviewerRole": "internal-review-board",